06:00:23.228745 IP 10.138.33.27.11212 > 10.130.113.120.35934: S 2601366203:2601366203(0) ack 4097114848 win 5792 <mss 1460,sackOK,timestamp 2050874201 60682626,nop,wscale 7>
06:00:23.243966 IP 10.130.113.120.32940 > 10.138.33.27.11211: S 4105327727:4105327727(0) win 5840 <mss 1460,sackOK,timestamp 60682630 0,nop,wscale 7>
06:00:23.245070 IP 10.138.33.27.11211 > 10.130.113.120.32940: S 2607585746:2607585746(0) ack 4105327728 win 5792 <mss 1460,sackOK,timestamp 2050874205 60682630,nop,wscale 7>
06:00:23.270871 IP 10.130.113.120.32944 > 10.138.33.27.11211: S 4090836329:4090836329(0) win 5840 <mss 1460,sackOK,timestamp 60682637 0,nop,wscale 7>
06:00:23.272077 IP 10.138.33.27.11211 > 10.130.113.120.32944: S 2607237804:2607237804(0) ack 4090836330 win 5792 <mss 1460,sackOK,timestamp 2050874212 60682637,nop,wscale 7>
06:00:23.273748 IP 10.130.113.120.35943 > 10.138.33.27.11212: S 4102576322:4102576322(0) win 5840 <mss 1460,sackOK,timestamp 60682638 0,nop,wscale 7>
06:00:23.274877 IP 10.138.33.27.11212 > 10.130.113.120.35943: S 2603638082:2603638082(0) ack 4102576323 win 5792 <mss 1460,sackOK,timestamp 2050874213 60682638,nop,wscale 7>
06:00:23.300405 IP 10.130.113.120.32948 > 10.138.33.27.11211: S 4090207072:4090207072(0) win 5840 <mss 1460,sackOK,timestamp 60682645 0,nop,wscale 7>
06:00:23.301535 IP 10.138.33.27.11211 > 10.130.113.120.32948: S 2603750804:2603750804(0) ack 4090207073 win 5792 <mss 1460,sackOK,timestamp 2050874219 60682645,nop,wscale 7>
06:00:23.303253 IP 10.130.113.120.35947 > 10.138.33.27.11212: S 4097342877:4097342877(0) win 5840 <mss 1460,sackOK,timestamp 60682645 0,nop,wscale 7>
06:00:23.304381 IP 10.138.33.27.11212 > 10.130.113.120.35947: S 2601270877:2601270877(0) ack 4097342878 win 5792 <mss 1460,sackOK,timestamp 2050874220 60682645,nop,wscale 7>
06:00:23.306290 IP 10.130.113.120.32951 > 10.138.33.27.11211: S 4091485394:4091485394(0) win 5840 <mss 1460,sackOK,timestamp 60682646 0,nop,wscale 7>
06:00:23.307375 IP 10.138.33.27.11211 > 10.130.113.120.32951: S 2603003229:2603003229(0) ack 4091485395 win 5792 <mss 1460,sackOK,timestamp 2050874221 60682646,nop,wscale 7>
06:00:23.308983 IP 10.130.113.120.35951 > 10.138.33.27.11212: S 4096010684:4096010684(0) win 5840 <mss 1460,sackOK,timestamp 60682647 0,nop,wscale 7>
06:00:23.310080 IP 10.138.33.27.11212 > 10.130.113.120.35951: S 2606817520:2606817520(0) ack 4096010685 win 5792 <mss 1460,sackOK,timestamp 2050874222 60682647,nop,wscale 7>
06:00:23.327451 IP 10.130.113.120.32957 > 10.138.33.27.11211: S 4091901829:4091901829(0) win 5840 <mss 1460,sackOK,timestamp 60682651 0,nop,wscale 7>
06:00:23.328542 IP 10.138.33.27.11211 > 10.130.113.120.32957: S 2608570824:2608570824(0) ack 4091901830 win 5792 <mss 1460,sackOK,timestamp 2050874226 60682651,nop,wscale 7>
06:00:23.338575 IP 10.130.113.120.32961 > 10.138.33.27.11211: S 4105101999:4105101999(0) win 5840 <mss 1460,sackOK,timestamp 60682654 0,nop,wscale 7>
06:00:23.339764 IP 10.138.33.27.11211 > 10.130.113.120.32961: S 2605652275:2605652275(0) ack 4105102000 win 5792 <mss 1460,sackOK,timestamp 2050874229 60682654,nop,wscale 7>
06:00:23.341385 IP 10.130.113.120.35960 > 10.138.33.27.11212: S 4103951305:4103951305(0) win 5840 <mss 1460,sackOK,timestamp 60682655 0,nop,wscale 7>
06:00:23.342508 IP 10.138.33.27.11212 > 10.130.113.120.35960: S 2610576111:2610576111(0) ack 4103951306 win 5792 <mss 1460,sackOK,timestamp 2050874230 60682655,nop,wscale 7>
06:00:23.345306 IP 10.130.113.120.32965 > 10.138.33.27.11211: S 4094780725:4094780725(0) win 5840 <mss 1460,sackOK,timestamp 60682656 0,nop,wscale 7>
06:00:23.346063 IP 10.130.113.120.35964 > 10.138.33.27.11212: S 4097940562:4097940562(0) win 5840 <mss 1460,sackOK,timestamp 60682656 0,nop,wscale 7>
06:00:23.346408 IP 10.138.33.27.11211 > 10.130.113.120.32965: S 2604422595:2604422595(0) ack 4094780726 win 5792 <mss 1460,sackOK,timestamp 2050874231 60682656,nop,wscale 7>
06:00:23.347156 IP 10.138.33.27.11212 > 10.130.113.120.35964: S 2603414777:2603414777(0) ack 4097940563 win 5792 <mss 1460,sackOK,timestamp 2050874231 60682656,nop,wscale 7>
06:00:23.399317 IP 10.130.113.120.32970 > 10.138.33.27.11211: S 4103180741:4103180741(0) win 5840 <mss 1460,sackOK,timestamp 60682669 0,nop,wscale 7>
06:00:23.400387 IP 10.138.33.27.11211 > 10.130.113.120.32970: S 2598200426:2598200426(0) ack 4103180742 win 5792 <mss 1460,sackOK,timestamp 2050874244 60682669,nop,wscale 7>
06:00:23.403723 IP 10.130.113.120.35969 > 10.138.33.27.11212: S 4101947430:4101947430(0) win 5840 <mss 1460,sackOK,timestamp 60682670 0,nop,wscale 7>
06:00:23.404878 IP 10.138.33.27.11212 > 10.130.113.120.35969: S 2609072768:2609072768(0) ack 4101947431 win 5792 <mss 1460,sackOK,timestamp 2050874245 60682670,nop,wscale 7>
06:00:23.407327 IP 10.130.113.120.32973 > 10.138.33.27.11211: S 4099581364:4099581364(0) win 5840 <mss 1460,sackOK,timestamp 60682671 0,nop,wscale 7>
06:00:23.408490 IP 10.138.33.27.11211 > 10.130.113.120.32973: S 2609391863:2609391863(0) ack 4099581365 win 5792 <mss 1460,sackOK,timestamp 2050874246 60682671,nop,wscale 7>
06:00:23.413675 IP 10.130.113.120.35974 > 10.138.33.27.11212: S 4100030615:4100030615(0) win 5840 <mss 1460,sackOK,timestamp 60682673 0,nop,wscale 7>
06:00:23.414806 IP 10.138.33.27.11212 > 10.130.113.120.35974: S 2607560991:2607560991(0) ack 4100030616 win 5792 <mss 1460,sackOK,timestamp 2050874248 60682673,nop,wscale 7>
06:00:23.422003 IP 10.130.113.120.32978 > 10.138.33.27.11211: S 4097694167:4097694167(0) win 5840 <mss 1460,sackOK,timestamp 60682675 0,nop,wscale 7>
06:00:23.423044 IP 10.138.33.27.11211 > 10.130.113.120.32978: S 2596644323:2596644323(0) ack 4097694168 win 5792 <mss 1460,sackOK,timestamp 2050874250 60682675,nop,wscale 7>
06:00:23.426096 IP 10.130.113.120.35977 > 10.138.33.27.11212: S 4102373789:4102373789(0) win 5840 <mss 1460,sackOK,timestamp 60682676 0,nop,wscale 7>
06:00:23.427288 IP 10.138.33.27.11212 > 10.130.113.120.35977: S 2605524782:2605524782(0) ack 4102373790 win 5792 <mss 1460,sackOK,timestamp 2050874251 60682676,nop,wscale 7>
06:00:23.458512 IP 10.130.113.120.32982 > 10.138.33.27.11211: S 4102757062:4102757062(0) win 5840 <mss 1460,sackOK,timestamp 60682684 0,nop,wscale 7>
06:00:23.459690 IP 10.138.33.27.11211 > 10.130.113.120.32982: S 2612649533:2612649533(0) ack 4102757063 win 5792 <mss 1460,sackOK,timestamp 2050874259 60682684,nop,wscale 7>
06:00:23.477205 IP 10.130.113.120.32985 > 10.138.33.27.11211: S 4102376608:4102376608(0) win 5840 <mss 1460,sackOK,timestamp 60682689 0,nop,wscale 7>
06:00:23.478311 IP 10.138.33.27.11211 > 10.130.113.120.32985: S 2605588220:2605588220(0) ack 4102376609 win 5792 <mss 1460,sackOK,timestamp 2050874264 60682689,nop,wscale 7>
06:00:23.490316 IP 10.130.113.120.35985 > 10.138.33.27.11212: S 4104658406:4104658406(0) win 5840 <mss 1460,sackOK,timestamp 60682692 0,nop,wscale 7>
06:00:23.491539 IP 10.138.33.27.11212 > 10.130.113.120.35985: S 2606113888:2606113888(0) ack 4104658407 win 5792 <mss 1460,sackOK,timestamp 2050874267 60682692,nop,wscale 7>
06:00:23.507078 IP 10.130.113.120.32989 > 10.138.33.27.11211: S 4092069455:4092069455(0) win 5840 <mss 1460,sackOK,timestamp 60682696 0,nop,wscale 7>
06:00:23.508163 IP 10.138.33.27.11211 > 10.130.113.120.32989: S 2602984844:2602984844(0) ack 4092069456 win 5792 <mss 1460,sackOK,timestamp 2050874271 60682696,nop,wscale 7>
06:00:23.509733 IP 10.130.113.120.35988 > 10.138.33.27.11212: S 4104470736:4104470736(0) win 5840 <mss 1460,sackOK,timestamp 60682697 0,nop,wscale 7>
06:00:23.510807 IP 10.138.33.27.11212 > 10.130.113.120.35988: S 2605947310:2605947310(0) ack 4104470737 win 5792 <mss 1460,sackOK,timestamp 2050874272 60682697,nop,wscale 7>
06:00:23.533131 IP 10.130.113.120.32993 > 10.138.33.27.11211: S 4092576880:4092576880(0) win 5840 <mss 1460,sackOK,timestamp 60682703 0,nop,wscale 7>
06:00:23.534275 IP 10.138.33.27.11211 > 10.130.113.120.32993: S 2604109703:2604109703(0) ack 4092576881 win 5792 <mss 1460,sackOK,timestamp 2050874278 60682703,nop,wscale 7>
06:00:23.559670 IP 10.130.113.120.35993 > 10.138.33.27.11212: S 4103614948:4103614948(0) win 5840 <mss 1460,sackOK,timestamp 60682709 0,nop,wscale 7>
06:00:23.560827 IP 10.138.33.27.11212 > 10.130.113.120.35993: S 2609061864:2609061864(0) ack 4103614949 win 5792 <mss 1460,sackOK,timestamp 2050874284 60682709,nop,wscale 7>
06:00:23.621462 IP 10.130.113.120.32997 > 10.138.33.27.11211: S 4098459350:4098459350(0) win 5840 <mss 1460,sackOK,timestamp 60682725 0,nop,wscale 7>
06:00:23.622560 IP 10.138.33.27.11211 > 10.130.113.120.32997: S 2602235052:2602235052(0) ack 4098459351 win 5792 <mss 1460,sackOK,timestamp 2050874300 60682725,nop,wscale 7>
06:00:23.644585 IP 10.130.113.120.35997 > 10.138.33.27.11212: S 4092664732:4092664732(0) win 5840 <mss 1460,sackOK,timestamp 60682731 0,nop,wscale 7>
06:00:23.645673 IP 10.138.33.27.11212 > 10.130.113.120.35997: S 2606228710:2606228710(0) ack 4092664733 win 5792 <mss 1460,sackOK,timestamp 2050874305 60682731,nop,wscale 7>
06:00:23.663014 IP 10.130.113.120.33001 > 10.138.33.27.11211: S 4100146817:4100146817(0) win 5840 <mss 1460,sackOK,timestamp 60682735 0,nop,wscale 7>
06:00:23.664095 IP 10.138.33.27.11211 > 10.130.113.120.33001: S 2612078132:2612078132(0) ack 4100146818 win 5792 <mss 1460,sackOK,timestamp 2050874310 60682735,nop,wscale 7>
06:00:23.717865 IP 10.130.113.120.36003 > 10.138.33.27.11212: S 4099191540:4099191540(0) win 5840 <mss 1460,sackOK,timestamp 60682749 0,nop,wscale 7>
06:00:23.718959 IP 10.138.33.27.11212 > 10.130.113.120.36003: S 2603175301:2603175301(0) ack 4099191541 win 5792 <mss 1460,sackOK,timestamp 2050874324 60682749,nop,wscale 7>
06:00:23.734423 IP 10.130.113.120.33011 > 10.138.33.27.11211: S 4092458925:4092458925(0) win 5840 <mss 1460,sackOK,timestamp 60682753 0,nop,wscale 7>
06:00:23.735550 IP 10.138.33.27.11211 > 10.130.113.120.33011: S 2605141376:2605141376(0) ack 4092458926 win 5792 <mss 1460,sackOK,timestamp 2050874328 60682753,nop,wscale 7>
06:00:23.736333 IP 10.130.113.120.36010 > 10.138.33.27.11212: S 4100290049:4100290049(0) win 5840 <mss 1460,sackOK,timestamp 60682753 0,nop,wscale 7>
06:00:23.737430 IP 10.138.33.27.11212 > 10.130.113.120.36010: S 2608705110:2608705110(0) ack 4100290050 win 5792 <mss 1460,sackOK,timestamp 2050874328 60682753,nop,wscale 7>
06:00:23.744118 IP 10.130.113.120.36013 > 10.138.33.27.11212: S 4096866846:4096866846(0) win 5840 <mss 1460,sackOK,timestamp 60682755 0,nop,wscale 7>
06:00:23.745340 IP 10.138.33.27.11212 > 10.130.113.120.36013: S 2610676723:2610676723(0) ack 4096866847 win 5792 <mss 1460,sackOK,timestamp 2050874330 60682755,nop,wscale 7>
06:00:23.747659 IP 10.130.113.120.36015 > 10.138.33.27.11212: S 4094314790:4094314790(0) win 5840 <mss 1460,sackOK,timestamp 60682756 0,nop,wscale 7>
06:00:23.748810 IP 10.138.33.27.11212 > 10.130.113.120.36015: S 2600087343:2600087343(0) ack 4094314791 win 5792 <mss 1460,sackOK,timestamp 2050874331 60682756,nop,wscale 7>
06:00:23.754546 IP 10.130.113.120.36016 > 10.138.33.27.11212: S 4091825193:4091825193(0) win 5840 <mss 1460,sackOK,timestamp 60682758 0,nop,wscale 7>
06:00:23.755694 IP 10.138.33.27.11212 > 10.130.113.120.36016: S 2604090140:2604090140(0) ack 4091825194 win 5792 <mss 1460,sackOK,timestamp 2050874333 60682758,nop,wscale 7>
06:00:23.762475 IP 10.130.113.120.33022 > 10.138.33.27.11211: S 4106133847:4106133847(0) win 5840 <mss 1460,sackOK,timestamp 60682760 0,nop,wscale 7>
06:00:23.763795 IP 10.138.33.27.11211 > 10.130.113.120.33022: S 2598352911:2598352911(0) ack 4106133848 win 5792 <mss 1460,sackOK,timestamp 2050874335 60682760,nop,wscale 7>
06:00:23.768130 IP 10.130.113.120.36021 > 10.138.33.27.11212: S 4102271691:4102271691(0) win 5840 <mss 1460,sackOK,timestamp 60682761 0,nop,wscale 7>
06:00:23.769260 IP 10.138.33.27.11212 > 10.130.113.120.36021: S 2605590491:2605590491(0) ack 4102271692 win 5792 <mss 1460,sackOK,timestamp 2050874336 60682761,nop,wscale 7>
06:00:23.769514 IP 10.130.113.120.33025 > 10.138.33.27.11211: S 4105384370:4105384370(0) win 5840 <mss 1460,sackOK,timestamp 60682762 0,nop,wscale 7>
06:00:23.770644 IP 10.138.33.27.11211 > 10.130.113.120.33025: S 2610473920:2610473920(0) ack 4105384371 win 5792 <mss 1460,sackOK,timestamp 2050874337 60682762,nop,wscale 7>
06:00:23.772771 IP 10.130.113.120.36025 > 10.138.33.27.11212: S 4099820019:4099820019(0) win 5840 <mss 1460,sackOK,timestamp 60682763 0,nop,wscale 7>
06:00:23.773825 IP 10.138.33.27.11212 > 10.130.113.120.36025: S 2599168288:2599168288(0) ack 4099820020 win 5792 <mss 1460,sackOK,timestamp 2050874337 60682763,nop,wscale 7>
06:00:23.794249 IP 10.130.113.120.33030 > 10.138.33.27.11211: S 4098040693:4098040693(0) win 5840 <mss 1460,sackOK,timestamp 60682768 0,nop,wscale 7>
06:00:23.795358 IP 10.138.33.27.11211 > 10.130.113.120.33030: S 2607993319:2607993319(0) ack 4098040694 win 5792 <mss 1460,sackOK,timestamp 2050874343 60682768,nop,wscale 7>
06:00:23.813650 IP 10.130.113.120.36030 > 10.138.33.27.11212: S 4102495848:4102495848(0) win 5840 <mss 1460,sackOK,timestamp 60682773 0,nop,wscale 7>
06:00:23.814837 IP 10.138.33.27.11212 > 10.130.113.120.36030: S 2601472984:2601472984(0) ack 4102495849 win 5792 <mss 1460,sackOK,timestamp 2050874348 60682773,nop,wscale 7>
06:00:23.817221 IP 10.130.113.120.33035 > 10.138.33.27.11211: S 4096601313:4096601313(0) win 5840 <mss 1460,sackOK,timestamp 60682774 0,nop,wscale 7>
06:00:23.818366 IP 10.138.33.27.11211 > 10.130.113.120.33035: S 2609010168:2609010168(0) ack 4096601314 win 5792 <mss 1460,sackOK,timestamp 2050874349 60682774,nop,wscale 7>
06:00:23.820816 IP 10.130.113.120.33037 > 10.138.33.27.11211: S 4097292567:4097292567(0) win 5840 <mss 1460,sackOK,timestamp 60682775 0,nop,wscale 7>
06:00:23.821938 IP 10.138.33.27.11211 > 10.130.113.120.33037: S 2602153613:2602153613(0) ack 4097292568 win 5792 <mss 1460,sackOK,timestamp 2050874349 60682775,nop,wscale 7>
06:00:23.824029 IP 10.130.113.120.33040 > 10.138.33.27.11211: S 4106168549:4106168549(0) win 5840 <mss 1460,sackOK,timestamp 60682775 0,nop,wscale 7>
06:00:23.825154 IP 10.138.33.27.11211 > 10.130.113.120.33040: S 2607873074:2607873074(0) ack 4106168550 win 5792 <mss 1460,sackOK,timestamp 2050874350 60682775,nop,wscale 7>
06:00:23.827154 IP 10.130.113.120.36041 > 10.138.33.27.11212: S 4102002367:4102002367(0) win 5840 <mss 1460,sackOK,timestamp 60682776 0,nop,wscale 7>
06:00:23.828200 IP 10.138.33.27.11212 > 10.130.113.120.36041: S 2604247894:2604247894(0) ack 4102002368 win 5792 <mss 1460,sackOK,timestamp 2050874351 60682776,nop,wscale 7>
06:00:23.828417 IP 10.130.113.120.33044 > 10.138.33.27.11211: S 4093868872:4093868872(0) win 5840 <mss 1460,sackOK,timestamp 60682777 0,nop,wscale 7>
06:00:23.829548 IP 10.138.33.27.11211 > 10.130.113.120.33044: S 2607953459:2607953459(0) ack 4093868873 win 5792 <mss 1460,sackOK,timestamp 2050874351 60682777,nop,wscale 7>
06:00:23.840415 IP 10.130.113.120.36048 > 10.138.33.27.11212: S 4099486471:4099486471(0) win 5840 <mss 1460,sackOK,timestamp 60682780 0,nop,wscale 7>
06:00:23.841542 IP 10.138.33.27.11212 > 10.130.113.120.36048: S 2613003693:2613003693(0) ack 4099486472 win 5792 <mss 1460,sackOK,timestamp 2050874354 60682780,nop,wscale 7>
06:00:23.842312 IP 10.130.113.120.36050 > 10.138.33.27.11212: S 4099190248:4099190248(0) win 5840 <mss 1460,sackOK,timestamp 60682780 0,nop,wscale 7>
06:00:23.843483 IP 10.138.33.27.11212 > 10.130.113.120.36050: S 2604015416:2604015416(0) ack 4099190249 win 5792 <mss 1460,sackOK,timestamp 2050874355 60682780,nop,wscale 7>
06:00:23.858954 IP 10.130.113.120.33057 > 10.138.33.27.11211: S 4105665988:4105665988(0) win 5840 <mss 1460,sackOK,timestamp 60682784 0,nop,wscale 7>
06:00:23.860128 IP 10.138.33.27.11211 > 10.130.113.120.33057: S 2597423288:2597423288(0) ack 4105665989 win 5792 <mss 1460,sackOK,timestamp 2050874359 60682784,nop,wscale 7>
06:00:23.860991 IP 10.130.113.120.33058 > 10.138.33.27.11211: S 4097416811:4097416811(0) win 5840 <mss 1460,sackOK,timestamp 60682785 0,nop,wscale 7>
06:00:23.861898 IP 10.130.113.120.36057 > 10.138.33.27.11212: S 4101103969:4101103969(0) win 5840 <mss 1460,sackOK,timestamp 60682785 0,nop,wscale 7>
06:00:23.862097 IP 10.138.33.27.11211 > 10.130.113.120.33058: S 2607886425:2607886425(0) ack 4097416812 win 5792 <mss 1460,sackOK,timestamp 2050874360 60682785,nop,wscale 7>
06:00:23.862987 IP 10.138.33.27.11212 > 10.130.113.120.36057: S 2601852846:2601852846(0) ack 4101103970 win 5792 <mss 1460,sackOK,timestamp 2050874360 60682785,nop,wscale 7>
06:00:23.863748 IP 10.130.113.120.36058 > 10.138.33.27.11212: S 4101847754:4101847754(0) win 5840 <mss 1460,sackOK,timestamp 60682785 0,nop,wscale 7>
06:00:23.864934 IP 10.138.33.27.11212 > 10.130.113.120.36058: S 2605111370:2605111370(0) ack 4101847755 win 5792 <mss 1460,sackOK,timestamp 2050874360 60682785,nop,wscale 7>
06:00:23.868061 IP 10.130.113.120.33064 > 10.138.33.27.11211: S 4103870628:4103870628(0) win 5840 <mss 1460,sackOK,timestamp 60682786 0,nop,wscale 7>
06:00:23.869176 IP 10.138.33.27.11211 > 10.130.113.120.33064: S 2604132298:2604132298(0) ack 4103870629 win 5792 <mss 1460,sackOK,timestamp 2050874361 60682786,nop,wscale 7>
06:00:23.871119 IP 10.130.113.120.36063 > 10.138.33.27.11212: S 4098760656:4098760656(0) win 5840 <mss 1460,sackOK,timestamp 60682787 0,nop,wscale 7>
06:00:23.872176 IP 10.138.33.27.11212 > 10.130.113.120.36063: S 2613519981:2613519981(0) ack 4098760657 win 5792 <mss 1460,sackOK,timestamp 2050874362 60682787,nop,wscale 7>
06:00:23.896533 IP 10.130.113.120.33069 > 10.138.33.27.11211: S 4091178585:4091178585(0) win 5840 <mss 1460,sackOK,timestamp 60682794 0,nop,wscale 7>
06:00:23.897614 IP 10.138.33.27.11211 > 10.130.113.120.33069: S 2608906626:2608906626(0) ack 4091178586 win 5792 <mss 1460,sackOK,timestamp 2050874368 60682794,nop,wscale 7>
06:00:23.904566 IP 10.130.113.120.33071 > 10.138.33.27.11211: S 4095707687:4095707687(0) win 5840 <mss 1460,sackOK,timestamp 60682796 0,nop,wscale 7>
06:00:23.905724 IP 10.138.33.27.11211 > 10.130.113.120.33071: S 2609495975:2609495975(0) ack 4095707688 win 5792 <mss 1460,sackOK,timestamp 2050874370 60682796,nop,wscale 7>
06:00:23.907510 IP 10.130.113.120.36071 > 10.138.33.27.11212: S 4090928769:4090928769(0) win 5840 <mss 1460,sackOK,timestamp 60682796 0,nop,wscale 7>
06:00:23.908596 IP 10.138.33.27.11212 > 10.130.113.120.36071: S 2600800364:2600800364(0) ack 4090928770 win 5792 <mss 1460,sackOK,timestamp 2050874371 60682796,nop,wscale 7>
06:00:23.919359 IP 10.130.113.120.36073 > 10.138.33.27.11212: S 4097000208:4097000208(0) win 5840 <mss 1460,sackOK,timestamp 60682799 0,nop,wscale 7>
06:00:23.920524 IP 10.138.33.27.11212 > 10.130.113.120.36073: S 2601937905:2601937905(0) ack 4097000209 win 5792 <mss 1460,sackOK,timestamp 2050874374 60682799,nop,wscale 7>
06:00:23.921728 IP 10.130.113.120.33077 > 10.138.33.27.11211: S 4105929735:4105929735(0) win 5840 <mss 1460,sackOK,timestamp 60682800 0,nop,wscale 7>
06:00:23.922810 IP 10.138.33.27.11211 > 10.130.113.120.33077: S 2609247675:2609247675(0) ack 4105929736 win 5792 <mss 1460,sackOK,timestamp 2050874375 60682800,nop,wscale 7>
06:00:23.924462 IP 10.130.113.120.33079 > 10.138.33.27.11211: S 4091931883:4091931883(0) win 5840 <mss 1460,sackOK,timestamp 60682801 0,nop,wscale 7>
06:00:23.925556 IP 10.138.33.27.11211 > 10.130.113.120.33079: S 2603915505:2603915505(0) ack 4091931884 win 5792 <mss 1460,sackOK,timestamp 2050874375 60682801,nop,wscale 7>
06:00:23.936029 IP 10.130.113.120.36082 > 10.138.33.27.11212: S 4090295262:4090295262(0) win 5840 <mss 1460,sackOK,timestamp 60682803 0,nop,wscale 7>
06:00:23.937183 IP 10.138.33.27.11212 > 10.130.113.120.36082: S 2610436027:2610436027(0) ack 4090295263 win 5792 <mss 1460,sackOK,timestamp 2050874378 60682803,nop,wscale 7>
06:00:23.941451 IP 10.130.113.120.33085 > 10.138.33.27.11211: S 4098014679:4098014679(0) win 5840 <mss 1460,sackOK,timestamp 60682805 0,nop,wscale 7>
06:00:23.941829 IP 10.130.113.120.33086 > 10.138.33.27.11211: S 4101572332:4101572332(0) win 5840 <mss 1460,sackOK,timestamp 60682805 0,nop,wscale 7>
06:00:23.942244 IP 10.130.113.120.36085 > 10.138.33.27.11212: S 4105354604:4105354604(0) win 5840 <mss 1460,sackOK,timestamp 60682805 0,nop,wscale 7>
06:00:23.942600 IP 10.138.33.27.11211 > 10.130.113.120.33085: S 2611138103:2611138103(0) ack 4098014680 win 5792 <mss 1460,sackOK,timestamp 2050874380 60682805,nop,wscale 7>
06:00:23.943051 IP 10.138.33.27.11211 > 10.130.113.120.33086: S 2601998131:2601998131(0) ack 4101572333 win 5792 <mss 1460,sackOK,timestamp 2050874380 60682805,nop,wscale 7>
06:00:23.943305 IP 10.138.33.27.11212 > 10.130.113.120.36085: S 2608050921:2608050921(0) ack 4105354605 win 5792 <mss 1460,sackOK,timestamp 2050874380 60682805,nop,wscale 7>
06:00:23.945889 IP 10.130.113.120.36086 > 10.138.33.27.11212: S 4094698676:4094698676(0) win 5840 <mss 1460,sackOK,timestamp 60682806 0,nop,wscale 7>
06:00:23.947072 IP 10.138.33.27.11212 > 10.130.113.120.36086: S 2606993832:2606993832(0) ack 4094698677 win 5792 <mss 1460,sackOK,timestamp 2050874381 60682806,nop,wscale 7>
06:00:23.953983 IP 10.130.113.120.33092 > 10.138.33.27.11211: S 4092953237:4092953237(0) win 5840 <mss 1460,sackOK,timestamp 60682808 0,nop,wscale 7>
06:00:23.954057 IP 10.130.113.120.36091 > 10.138.33.27.11212: S 4106359382:4106359382(0) win 5840 <mss 1460,sackOK,timestamp 60682808 0,nop,wscale 7>
06:00:23.955139 IP 10.138.33.27.11211 > 10.130.113.120.33092: S 2608802579:2608802579(0) ack 4092953238 win 5792 <mss 1460,sackOK,timestamp 2050874383 60682808,nop,wscale 7>
06:00:23.955242 IP 10.138.33.27.11212 > 10.130.113.120.36091: S 2613478332:2613478332(0) ack 4106359383 win 5792 <mss 1460,sackOK,timestamp 2050874383 60682808,nop,wscale 7>
06:00:23.962160 IP 10.130.113.120.33096 > 10.138.33.27.11211: S 4105063336:4105063336(0) win 5840 <mss 1460,sackOK,timestamp 60682810 0,nop,wscale 7>
06:00:23.963055 IP 10.130.113.120.33097 > 10.138.33.27.11211: S 4104571087:4104571087(0) win 5840 <mss 1460,sackOK,timestamp 60682810 0,nop,wscale 7>
06:00:23.963388 IP 10.138.33.27.11211 > 10.130.113.120.33096: S 2601410080:2601410080(0) ack 4105063337 win 5792 <mss 1460,sackOK,timestamp 2050874385 60682810,nop,wscale 7>
06:00:23.964192 IP 10.138.33.27.11211 > 10.130.113.120.33097: S 2612583183:2612583183(0) ack 4104571088 win 5792 <mss 1460,sackOK,timestamp 2050874385 60682810,nop,wscale 7>
06:00:23.971423 IP 10.130.113.120.36097 > 10.138.33.27.11212: S 4102229681:4102229681(0) win 5840 <mss 1460,sackOK,timestamp 60682812 0,nop,wscale 7>
06:00:23.972038 IP 10.130.113.120.36098 > 10.138.33.27.11212: S 4095217800:4095217800(0) win 5840 <mss 1460,sackOK,timestamp 60682812 0,nop,wscale 7>
06:00:23.972572 IP 10.138.33.27.11212 > 10.130.113.120.36097: S 2599492332:2599492332(0) ack 4102229682 win 5792 <mss 1460,sackOK,timestamp 2050874387 60682812,nop,wscale 7>
06:00:23.973180 IP 10.138.33.27.11212 > 10.130.113.120.36098: S 2598415657:2598415657(0) ack 4095217801 win 5792 <mss 1460,sackOK,timestamp 2050874387 60682812,nop,wscale 7>
06:00:23.984859 IP 10.130.113.120.36099 > 10.138.33.27.11212: S 4096544670:4096544670(0) win 5840 <mss 1460,sackOK,timestamp 60682816 0,nop,wscale 7>
06:00:23.985992 IP 10.138.33.27.11212 > 10.130.113.120.36099: S 2599958865:2599958865(0) ack 4096544671 win 5792 <mss 1460,sackOK,timestamp 2050874390 60682816,nop,wscale 7>
06:00:24.014016 IP 10.130.113.120.33108 > 10.138.33.27.11211: S 4104546400:4104546400(0) win 5840 <mss 1460,sackOK,timestamp 60682823 0,nop,wscale 7>
06:00:24.015167 IP 10.138.33.27.11211 > 10.130.113.120.33108: S 2611002722:2611002722(0) ack 4104546401 win 5792 <mss 1460,sackOK,timestamp 2050874398 60682823,nop,wscale 7>
06:00:24.016995 IP 10.130.113.120.36108 > 10.138.33.27.11212: S 4092916436:4092916436(0) win 5840 <mss 1460,sackOK,timestamp 60682824 0,nop,wscale 7>
06:00:24.018118 IP 10.138.33.27.11212 > 10.130.113.120.36108: S 2605852611:2605852611(0) ack 4092916437 win 5792 <mss 1460,sackOK,timestamp 2050874399 60682824,nop,wscale 7>
06:00:24.022222 IP 10.130.113.120.33113 > 10.138.33.27.11211: S 4095436393:4095436393(0) win 5840 <mss 1460,sackOK,timestamp 60682825 0,nop,wscale 7>
06:00:24.023352 IP 10.138.33.27.11211 > 10.130.113.120.33113: S 2599644459:2599644459(0) ack 4095436394 win 5792 <mss 1460,sackOK,timestamp 2050874400 60682825,nop,wscale 7>
06:00:24.040897 IP 10.130.113.120.36116 > 10.138.33.27.11212: S 4102497767:4102497767(0) win 5840 <mss 1460,sackOK,timestamp 60682830 0,nop,wscale 7>
06:00:24.042016 IP 10.138.33.27.11212 > 10.130.113.120.36116: S 2604709573:2604709573(0) ack 4102497768 win 5792 <mss 1460,sackOK,timestamp 2050874404 60682830,nop,wscale 7>
06:00:24.046933 IP 10.130.113.120.33120 > 10.138.33.27.11211: S 4095634052:4095634052(0) win 5840 <mss 1460,sackOK,timestamp 60682831 0,nop,wscale 7>
06:00:24.048060 IP 10.138.33.27.11211 > 10.130.113.120.33120: S 2606221225:2606221225(0) ack 4095634053 win 5792 <mss 1460,sackOK,timestamp 2050874406 60682831,nop,wscale 7>
06:00:24.049843 IP 10.130.113.120.36119 > 10.138.33.27.11212: S 4097638043:4097638043(0) win 5840 <mss 1460,sackOK,timestamp 60682832 0,nop,wscale 7>
06:00:24.051103 IP 10.138.33.27.11212 > 10.130.113.120.36119: S 2610513612:2610513612(0) ack 4097638044 win 5792 <mss 1460,sackOK,timestamp 2050874407 60682832,nop,wscale 7>
06:00:24.065202 IP 10.130.113.120.33125 > 10.138.33.27.11211: S 4091133122:4091133122(0) win 5840 <mss 1460,sackOK,timestamp 60682836 0,nop,wscale 7>
06:00:24.066390 IP 10.138.33.27.11211 > 10.130.113.120.33125: S 2598541518:2598541518(0) ack 4091133123 win 5792 <mss 1460,sackOK,timestamp 2050874411 60682836,nop,wscale 7>
06:00:24.066461 IP 10.130.113.120.33128 > 10.138.33.27.11211: S 4096402097:4096402097(0) win 5840 <mss 1460,sackOK,timestamp 60682836 0,nop,wscale 7>
06:00:24.066550 IP 10.130.113.120.33129 > 10.138.33.27.11211: S 4094441824:4094441824(0) win 5840 <mss 1460,sackOK,timestamp 60682836 0,nop,wscale 7>
06:00:24.067587 IP 10.138.33.27.11211 > 10.130.113.120.33128: S 2613451481:2613451481(0) ack 4096402098 win 5792 <mss 1460,sackOK,timestamp 2050874411 60682836,nop,wscale 7>
06:00:24.067748 IP 10.138.33.27.11211 > 10.130.113.120.33129: S 2600428822:2600428822(0) ack 4094441825 win 5792 <mss 1460,sackOK,timestamp 2050874411 60682836,nop,wscale 7>
06:00:24.073250 IP 10.130.113.120.33133 > 10.138.33.27.11211: S 4093155430:4093155430(0) win 5840 <mss 1460,sackOK,timestamp 60682838 0,nop,wscale 7>
06:00:24.074416 IP 10.138.33.27.11211 > 10.130.113.120.33133: S 2602623259:2602623259(0) ack 4093155431 win 5792 <mss 1460,sackOK,timestamp 2050874413 60682838,nop,wscale 7>
06:00:24.079915 IP 10.130.113.120.36134 > 10.138.33.27.11212: S 4104594148:4104594148(0) win 5840 <mss 1460,sackOK,timestamp 60682839 0,nop,wscale 7>
06:00:24.081160 IP 10.138.33.27.11212 > 10.130.113.120.36134: S 2600582167:2600582167(0) ack 4104594149 win 5792 <mss 1460,sackOK,timestamp 2050874414 60682839,nop,wscale 7>
06:00:24.093299 IP 10.130.113.120.33142 > 10.138.33.27.11211: S 4094883228:4094883228(0) win 5840 <mss 1460,sackOK,timestamp 60682843 0,nop,wscale 7>
06:00:24.094129 IP 10.130.113.120.33143 > 10.138.33.27.11211: S 4092761109:4092761109(0) win 5840 <mss 1460,sackOK,timestamp 60682843 0,nop,wscale 7>
06:00:24.094399 IP 10.138.33.27.11211 > 10.130.113.120.33142: S 2600872032:2600872032(0) ack 4094883229 win 5792 <mss 1460,sackOK,timestamp 2050874418 60682843,nop,wscale 7>
06:00:24.095319 IP 10.138.33.27.11211 > 10.130.113.120.33143: S 2602726321:2602726321(0) ack 4092761110 win 5792 <mss 1460,sackOK,timestamp 2050874418 60682843,nop,wscale 7>
06:00:24.096125 IP 10.130.113.120.33145 > 10.138.33.27.11211: S 4091496216:4091496216(0) win 5840 <mss 1460,sackOK,timestamp 60682843 0,nop,wscale 7>
06:00:24.097343 IP 10.138.33.27.11211 > 10.130.113.120.33145: S 2600181425:2600181425(0) ack 4091496217 win 5792 <mss 1460,sackOK,timestamp 2050874418 60682843,nop,wscale 7>
06:00:24.097749 IP 10.130.113.120.36144 > 10.138.33.27.11212: S 4100865314:4100865314(0) win 5840 <mss 1460,sackOK,timestamp 60682844 0,nop,wscale 7>
06:00:24.098044 IP 10.130.113.120.36145 > 10.138.33.27.11212: S 4096530781:4096530781(0) win 5840 <mss 1460,sackOK,timestamp 60682844 0,nop,wscale 7>
06:00:24.098130 IP 10.130.113.120.36146 > 10.138.33.27.11212: S 4094228263:4094228263(0) win 5840 <mss 1460,sackOK,timestamp 60682844 0,nop,wscale 7>
06:00:24.098825 IP 10.138.33.27.11212 > 10.130.113.120.36144: S 2608795223:2608795223(0) ack 4100865315 win 5792 <mss 1460,sackOK,timestamp 2050874419 60682844,nop,wscale 7>
06:00:24.099238 IP 10.130.113.120.36147 > 10.138.33.27.11212: S 4092173668:4092173668(0) win 5840 <mss 1460,sackOK,timestamp 60682844 0,nop,wscale 7>
06:00:24.099240 IP 10.138.33.27.11212 > 10.130.113.120.36145: S 2610157807:2610157807(0) ack 4096530782 win 5792 <mss 1460,sackOK,timestamp 2050874419 60682844,nop,wscale 7>
06:00:24.099320 IP 10.138.33.27.11212 > 10.130.113.120.36146: S 2607016138:2607016138(0) ack 4094228264 win 5792 <mss 1460,sackOK,timestamp 2050874419 60682844,nop,wscale 7>
06:00:24.100303 IP 10.138.33.27.11212 > 10.130.113.120.36147: S 2604436919:2604436919(0) ack 4092173669 win 5792 <mss 1460,sackOK,timestamp 2050874419 60682844,nop,wscale 7>
06:00:24.121113 IP 10.130.113.120.36152 > 10.138.33.27.11212: S 4099570961:4099570961(0) win 5840 <mss 1460,sackOK,timestamp 60682850 0,nop,wscale 7>
06:00:24.122227 IP 10.138.33.27.11212 > 10.130.113.120.36152: S 2610007592:2610007592(0) ack 4099570962 win 5792 <mss 1460,sackOK,timestamp 2050874425 60682850,nop,wscale 7>
06:00:24.158094 IP 10.130.113.120.33156 > 10.138.33.27.11211: S 4095652606:4095652606(0) win 5840 <mss 1460,sackOK,timestamp 60682859 0,nop,wscale 7>
06:00:24.159186 IP 10.138.33.27.11211 > 10.130.113.120.33156: S 2607587405:2607587405(0) ack 4095652607 win 5792 <mss 1460,sackOK,timestamp 2050874434 60682859,nop,wscale 7>
06:00:24.161273 IP 10.130.113.120.36155 > 10.138.33.27.11212: S 4093096503:4093096503(0) win 5840 <mss 1460,sackOK,timestamp 60682860 0,nop,wscale 7>
06:00:24.162385 IP 10.138.33.27.11212 > 10.130.113.120.36155: S 2603564447:2603564447(0) ack 4093096504 win 5792 <mss 1460,sackOK,timestamp 2050874435 60682860,nop,wscale 7>
06:00:24.166249 IP 10.130.113.120.33161 > 10.138.33.27.11211: S 4098935783:4098935783(0) win 5840 <mss 1460,sackOK,timestamp 60682861 0,nop,wscale 7>
06:00:24.167455 IP 10.138.33.27.11211 > 10.130.113.120.33161: S 2612723057:2612723057(0) ack 4098935784 win 5792 <mss 1460,sackOK,timestamp 2050874436 60682861,nop,wscale 7>
06:00:24.168339 IP 10.130.113.120.33163 > 10.138.33.27.11211: S 4093294628:4093294628(0) win 5840 <mss 1460,sackOK,timestamp 60682861 0,nop,wscale 7>
06:00:24.169532 IP 10.138.33.27.11211 > 10.130.113.120.33163: S 2606041432:2606041432(0) ack 4093294629 win 5792 <mss 1460,sackOK,timestamp 2050874436 60682861,nop,wscale 7>
06:00:24.169996 IP 10.130.113.120.33165 > 10.138.33.27.11211: S 4092241329:4092241329(0) win 5840 <mss 1460,sackOK,timestamp 60682862 0,nop,wscale 7>
06:00:24.171261 IP 10.138.33.27.11211 > 10.130.113.120.33165: S 2611174796:2611174796(0) ack 4092241330 win 5792 <mss 1460,sackOK,timestamp 2050874437 60682862,nop,wscale 7>
06:00:24.172044 IP 10.130.113.120.36166 > 10.138.33.27.11212: S 4104561231:4104561231(0) win 5840 <mss 1460,sackOK,timestamp 60682862 0,nop,wscale 7>
06:00:24.172919 IP 10.130.113.120.36167 > 10.138.33.27.11212: S 4091681725:4091681725(0) win 5840 <mss 1460,sackOK,timestamp 60682863 0,nop,wscale 7>
06:00:24.173108 IP 10.138.33.27.11212 > 10.130.113.120.36166: S 2603667845:2603667845(0) ack 4104561232 win 5792 <mss 1460,sackOK,timestamp 2050874437 60682862,nop,wscale 7>
06:00:24.174055 IP 10.138.33.27.11212 > 10.130.113.120.36167: S 2597348899:2597348899(0) ack 4091681726 win 5792 <mss 1460,sackOK,timestamp 2050874438 60682863,nop,wscale 7>
06:00:24.180194 IP 10.130.113.120.36170 > 10.138.33.27.11212: S 4102363336:4102363336(0) win 5840 <mss 1460,sackOK,timestamp 60682864 0,nop,wscale 7>
06:00:24.181351 IP 10.138.33.27.11212 > 10.130.113.120.36170: S 2610836612:2610836612(0) ack 4102363337 win 5792 <mss 1460,sackOK,timestamp 2050874439 60682864,nop,wscale 7>
06:00:24.193095 IP 10.130.113.120.33174 > 10.138.33.27.11211: S 4101958533:4101958533(0) win 5840 <mss 1460,sackOK,timestamp 60682868 0,nop,wscale 7>
06:00:24.194255 IP 10.138.33.27.11211 > 10.130.113.120.33174: S 2602781278:2602781278(0) ack 4101958534 win 5792 <mss 1460,sackOK,timestamp 2050874443 60682868,nop,wscale 7>
06:00:24.209052 IP 10.130.113.120.33178 > 10.138.33.27.11211: S 4103355461:4103355461(0) win 5840 <mss 1460,sackOK,timestamp 60682872 0,nop,wscale 7>
06:00:24.210221 IP 10.138.33.27.11211 > 10.130.113.120.33178: S 2602540560:2602540560(0) ack 4103355462 win 5792 <mss 1460,sackOK,timestamp 2050874447 60682872,nop,wscale 7>
06:00:24.212630 IP 10.130.113.120.33180 > 10.138.33.27.11211: S 4093896822:4093896822(0) win 5840 <mss 1460,sackOK,timestamp 60682873 0,nop,wscale 7>
06:00:24.213537 IP 10.130.113.120.33181 > 10.138.33.27.11211: S 4101563346:4101563346(0) win 5840 <mss 1460,sackOK,timestamp 60682873 0,nop,wscale 7>
06:00:24.213727 IP 10.138.33.27.11211 > 10.130.113.120.33180: S 2602037609:2602037609(0) ack 4093896823 win 5792 <mss 1460,sackOK,timestamp 2050874447 60682873,nop,wscale 7>
06:00:24.214719 IP 10.138.33.27.11211 > 10.130.113.120.33181: S 2607808684:2607808684(0) ack 4101563347 win 5792 <mss 1460,sackOK,timestamp 2050874448 60682873,nop,wscale 7>
06:00:24.216622 IP 10.130.113.120.36180 > 10.138.33.27.11212: S 4093177269:4093177269(0) win 5840 <mss 1460,sackOK,timestamp 60682874 0,nop,wscale 7>
06:00:24.217780 IP 10.138.33.27.11212 > 10.130.113.120.36180: S 2601001242:2601001242(0) ack 4093177270 win 5792 <mss 1460,sackOK,timestamp 2050874448 60682874,nop,wscale 7>
06:00:24.221756 IP 10.130.113.120.33187 > 10.138.33.27.11211: S 4102569477:4102569477(0) win 5840 <mss 1460,sackOK,timestamp 60682875 0,nop,wscale 7>
06:00:24.223028 IP 10.138.33.27.11211 > 10.130.113.120.33187: S 2600428034:2600428034(0) ack 4102569478 win 5792 <mss 1460,sackOK,timestamp 2050874450 60682875,nop,wscale 7>
06:00:24.225727 IP 10.130.113.120.36186 > 10.138.33.27.11212: S 4092374050:4092374050(0) win 5840 <mss 1460,sackOK,timestamp 60682876 0,nop,wscale 7>
06:00:24.226835 IP 10.138.33.27.11212 > 10.130.113.120.36186: S 2602867126:2602867126(0) ack 4092374051 win 5792 <mss 1460,sackOK,timestamp 2050874451 60682876,nop,wscale 7>
06:00:24.228645 IP 10.130.113.120.36188 > 10.138.33.27.11212: S 4094513816:4094513816(0) win 5840 <mss 1460,sackOK,timestamp 60682877 0,nop,wscale 7>
06:00:24.229759 IP 10.138.33.27.11212 > 10.130.113.120.36188: S 2598465429:2598465429(0) ack 4094513817 win 5792 <mss 1460,sackOK,timestamp 2050874451 60682877,nop,wscale 7>
06:00:24.233048 IP 10.130.113.120.33193 > 10.138.33.27.11211: S 4106931997:4106931997(0) win 5840 <mss 1460,sackOK,timestamp 60682878 0,nop,wscale 7>
06:00:24.234215 IP 10.138.33.27.11211 > 10.130.113.120.33193: S 2613534470:2613534470(0) ack 4106931998 win 5792 <mss 1460,sackOK,timestamp 2050874453 60682878,nop,wscale 7>
06:00:24.241954 IP 10.130.113.120.33197 > 10.138.33.27.11211: S 4092386259:4092386259(0) win 5840 <mss 1460,sackOK,timestamp 60682880 0,nop,wscale 7>
06:00:24.242805 IP 10.130.113.120.36197 > 10.138.33.27.11212: S 4095444774:4095444774(0) win 5840 <mss 1460,sackOK,timestamp 60682880 0,nop,wscale 7>
06:00:24.243112 IP 10.138.33.27.11211 > 10.130.113.120.33197: S 2611977053:2611977053(0) ack 4092386260 win 5792 <mss 1460,sackOK,timestamp 2050874455 60682880,nop,wscale 7>
06:00:24.244057 IP 10.138.33.27.11212 > 10.130.113.120.36197: S 2608373096:2608373096(0) ack 4095444775 win 5792 <mss 1460,sackOK,timestamp 2050874455 60682880,nop,wscale 7>
06:00:24.245100 IP 10.130.113.120.36198 > 10.138.33.27.11212: S 4102464361:4102464361(0) win 5840 <mss 1460,sackOK,timestamp 60682881 0,nop,wscale 7>
06:00:24.246270 IP 10.138.33.27.11212 > 10.130.113.120.36198: S 2604479422:2604479422(0) ack 4102464362 win 5792 <mss 1460,sackOK,timestamp 2050874456 60682881,nop,wscale 7>
06:00:24.246871 IP 10.130.113.120.33202 > 10.138.33.27.11211: S 4101718325:4101718325(0) win 5840 <mss 1460,sackOK,timestamp 60682881 0,nop,wscale 7>
06:00:24.247981 IP 10.138.33.27.11211 > 10.130.113.120.33202: S 2600552238:2600552238(0) ack 4101718326 win 5792 <mss 1460,sackOK,timestamp 2050874456 60682881,nop,wscale 7>
06:00:24.249702 IP 10.130.113.120.36202 > 10.138.33.27.11212: S 4104256396:4104256396(0) win 5840 <mss 1460,sackOK,timestamp 60682882 0,nop,wscale 7>
06:00:24.251368 IP 10.138.33.27.11212 > 10.130.113.120.36202: S 2601644461:2601644461(0) ack 4104256397 win 5792 <mss 1460,sackOK,timestamp 2050874457 60682882,nop,wscale 7>
06:00:24.256366 IP 10.130.113.120.36204 > 10.138.33.27.11212: S 4097617783:4097617783(0) win 5840 <mss 1460,sackOK,timestamp 60682883 0,nop,wscale 7>
06:00:24.257546 IP 10.138.33.27.11212 > 10.130.113.120.36204: S 2598544500:2598544500(0) ack 4097617784 win 5792 <mss 1460,sackOK,timestamp 2050874458 60682883,nop,wscale 7>
06:00:24.292927 IP 10.130.113.120.33208 > 10.138.33.27.11211: S 4093383666:4093383666(0) win 5840 <mss 1460,sackOK,timestamp 60682893 0,nop,wscale 7>
06:00:24.295446 IP 10.138.33.27.11211 > 10.130.113.120.33208: S 2605251271:2605251271(0) ack 4093383667 win 5792 <mss 1460,sackOK,timestamp 2050874468 60682893,nop,wscale 7>
06:00:24.312090 IP 10.130.113.120.36209 > 10.138.33.27.11212: S 4093120506:4093120506(0) win 5840 <mss 1460,sackOK,timestamp 60682897 0,nop,wscale 7>
06:00:24.313332 IP 10.138.33.27.11212 > 10.130.113.120.36209: S 2612998622:2612998622(0) ack 4093120507 win 5792 <mss 1460,sackOK,timestamp 2050874472 60682897,nop,wscale 7>
06:00:24.326286 IP 10.130.113.120.33213 > 10.138.33.27.11211: S 4103254256:4103254256(0) win 5840 <mss 1460,sackOK,timestamp 60682901 0,nop,wscale 7>
06:00:24.327379 IP 10.138.33.27.11211 > 10.130.113.120.33213: S 2602331549:2602331549(0) ack 4103254257 win 5792 <mss 1460,sackOK,timestamp 2050874476 60682901,nop,wscale 7>
06:00:24.329303 IP 10.130.113.120.33215 > 10.138.33.27.11211: S 4100991011:4100991011(0) win 5840 <mss 1460,sackOK,timestamp 60682902 0,nop,wscale 7>
06:00:24.330573 IP 10.138.33.27.11211 > 10.130.113.120.33215: S 2597326294:2597326294(0) ack 4100991012 win 5792 <mss 1460,sackOK,timestamp 2050874477 60682902,nop,wscale 7>
06:00:24.335319 IP 10.130.113.120.33218 > 10.138.33.27.11211: S 4102870318:4102870318(0) win 5840 <mss 1460,sackOK,timestamp 60682903 0,nop,wscale 7>
06:00:24.336457 IP 10.138.33.27.11211 > 10.130.113.120.33218: S 2612085585:2612085585(0) ack 4102870319 win 5792 <mss 1460,sackOK,timestamp 2050874478 60682903,nop,wscale 7>
06:00:24.337072 IP 10.130.113.120.36217 > 10.138.33.27.11212: S 4104878231:4104878231(0) win 5840 <mss 1460,sackOK,timestamp 60682904 0,nop,wscale 7>
06:00:24.338154 IP 10.138.33.27.11212 > 10.130.113.120.36217: S 2611294853:2611294853(0) ack 4104878232 win 5792 <mss 1460,sackOK,timestamp 2050874479 60682904,nop,wscale 7>
06:00:24.338228 IP 10.130.113.120.36218 > 10.138.33.27.11212: S 4107014117:4107014117(0) win 5840 <mss 1460,sackOK,timestamp 60682904 0,nop,wscale 7>
06:00:24.339349 IP 10.138.33.27.11212 > 10.130.113.120.36218: S 2611346087:2611346087(0) ack 4107014118 win 5792 <mss 1460,sackOK,timestamp 2050874479 60682904,nop,wscale 7>
06:00:24.340687 IP 10.130.113.120.36219 > 10.138.33.27.11212: S 4101865649:4101865649(0) win 5840 <mss 1460,sackOK,timestamp 60682905 0,nop,wscale 7>
06:00:24.341814 IP 10.130.113.120.33223 > 10.138.33.27.11211: S 4100884993:4100884993(0) win 5840 <mss 1460,sackOK,timestamp 60682905 0,nop,wscale 7>
06:00:24.341908 IP 10.138.33.27.11212 > 10.130.113.120.36219: S 2612907252:2612907252(0) ack 4101865650 win 5792 <mss 1460,sackOK,timestamp 2050874479 60682905,nop,wscale 7>
06:00:24.343003 IP 10.138.33.27.11211 > 10.130.113.120.33223: S 2611650540:2611650540(0) ack 4100884994 win 5792 <mss 1460,sackOK,timestamp 2050874480 60682905,nop,wscale 7>
06:00:24.346849 IP 10.130.113.120.36224 > 10.138.33.27.11212: S 4096761030:4096761030(0) win 5840 <mss 1460,sackOK,timestamp 60682906 0,nop,wscale 7>
